{
  "$schema": "./agent.schema.json",
  "name": "greeter",
  "description": "Sub-agent example for agent_call: echoes a greeting back using the echo tool.",
  "output_step": "greet",
  "steps": [
    {
      "id": "greet",
      "type": "tool_call",
      "tool": "echo",
      "input_template": "Hello, {{user_input}}!",
      "depends_on": []
    }
  ]
}
