{
  "$schema": "./agent.schema.json",
  "name": "supervisor_subagent",
  "description": "Sub-agent half of the supervisor-inside-agent_call combination test. Structurally identical to iterative_writer_agent.json's editor/draft loop, but with output_step set so it can actually be called via agent_call - iterative_writer_agent.json never needed that since nothing calls it as a sub-agent. Requires GROQ_API_KEY on the worker.",
  "steps": [
    {
      "id": "editor",
      "type": "supervisor",
      "depends_on": [],
      "prompt_template": "You are editing a short paragraph answering a question, judging the latest draft below.\n\nQuestion: {{user_input}}\n\nLatest draft:\n{{draft.output}}\n\nIf the draft answers the question clearly and concisely, respond with exactly: done\nOtherwise, respond with exactly: draft\n\nRespond with only one of those two words, nothing else.",
      "options": [
        "draft"
      ],
      "first_iteration_step": "draft"
    },
    {
      "id": "draft",
      "type": "llm_call",
      "depends_on": [
        "editor"
      ],
      "prompt_template": "Write a short, clear paragraph answering the question below. If a previous draft is shown, improve on it rather than starting over.\n\nQuestion: {{user_input}}\n\nPrevious draft (if any):\n{{draft.output}}"
    }
  ],
  "output_step": "editor"
}
